id,text,label_id,label_text
16014,One may not permit an objectionable question to be asked and speculate as to its answer before objection.,1,Facts
16015,"Statutory rape is the offense; the punishment, twenty-five years in the penitentiary.",1,Facts
16016,The undisputed testimony is as follows:,7,Invalid sentences
16017,"Appellant, who was the godfather of the complaining witness’ sister, went to the witness’ home after midnight on the occasion in question and asked to see a girl who was staying there.",1,Facts
16057,We find the evidence sufficient to support the jury’s verdict.,4,Analysis
16018,The complaining witness was thirteen years old at the time of the trial but only twelve years of age at the time of the commission of the offense.,1,Facts
16019,"She was told that her boy friend, Nick, was out in the car, too drunk to come in but that he was calling her.",1,Facts
16020,"Accompanying appellant out to the car, she found Nick was not among the other boys there.",1,Facts
16021,"Appellant told her to get in the car and they would take her to the place where he was supposed to be, drunk.",1,Facts
16022,"The prosecutrix got in the car and was driven to a vacant apartment on Applegrove, where Nick supposedly was.",1,Facts
16023,"The facts further reveal that in addition to the prosecutrix and the appellant, four other boys — Gerardo Ramirez Cantu, Daniel Ramerez, Florencio Garcia, and Johnny Hernandez — went inside.",1,Facts
16024,"The prosecutrix was told to go upstairs, which she did.",1,Facts
16025,"Not again seeing Nick, she started running downstairs but was pushed back.",1,Facts
16026,"She stated that the boys “grabbed” her; that “they were all around;” that Daniel Ramerez grabbed and pulled her to “the room,” and that the boys started tearing her slacks and panties.",1,Facts
16027,"These were the same boys, she stated, whom she had previously named as being with her on the steps and preventing her from going back downstairs, and that appellant was present.",1,Facts
16028,She later testified that she did not know which boys were there but that there were “around three boys there” holding her hands and legs.,1,Facts
16029,"The witness then testified that after she had been undressed from the waist down Ramerez first had intercourse with her and then the appellant had intercourse with her, as did, subsequently, the other boys.",1,Facts
16030,The record reveals that the appellant was present during the,1,Facts
16031,"By a formal bill of exception, appellant brings forward two contentions.",1,Facts
16032,"First, he complains of and submits as error the action of the trial court in failing to instruct the jury relative to the application of the suspended sentence law.",2,Issue
16033,"Appellant had duly filed his application for suspended sentence, with the affidavit in support thereof duly executed.",1,Facts
16034,"After the state had adduced all its testimony and had rested its case, the defendant then offered in evidence as his exhibit No. 1 the application for a suspended sentence, which he had filed with the papers of the case.",1,Facts
16035,"The application, with the affidavit, was admitted by the court “for whatever its worth.”",1,Facts
16036,Appellant then rested his case.,1,Facts
16037,"He cites numerous authorities, none of which are in point.",1,Facts
16038,Appellant contends that the offering in evidence of the application for the suspended sentence created a fact issue for the jury and that it made it incumbent upon the trial court to instruct upon and to present to the jury for its determination the issue of a suspended sentence.,2,Issue
16039,We do not agree with this contention.,5,Conclusion
16040,"For all practical purposes, the application for the suspended sentence, with the affidavit, was already in the evidence, without being admitted.",1,Facts
16041,"The suspended sentence statute, Art. 776, C.C.P., provides, in part, that in no case shall sentence be suspended except when the proof shall show that the defendant has never before been convicted of a felony in this state or in any other state.",3,Rule/Law/Holding
16042,This is an essential element in the suspended sentence statute.,6,Others
16043,The proof which appellant relies upon to comply with this provision of the statute is his application for suspended sentence already before the jury as a pleading.,1,Facts
16044,"In the application appellant “represents to the Court * * * that he has never before been convicted of-a felony during his life, neither in this state nor in any other,” followed by his",7,Invalid sentences
16045,We are cited to no authority holding that the defendant’s sworn application for suspended sentence constitutes proof requiring the submission of the issue to the jury.,1,Facts
16046,"652, 245 S.W. 2d 497, cited by appellant, the defendant testified at the trial that he had never been convicted of a felony, and was subject to cross-examination.",1,Facts
16047,"Here, appellant did not testify, but offered his own application for suspended sentence.",1,Facts
16048,He did not make himself available for cross-examination.,1,Facts
16082,Barnett was less specific in his testimony but did say that he observed appellant having intercourse from the rear with Pelton.,1,Facts
16049,"It has been the consistent holding of this court that a defendant can not take the witness stand for a limited purpose, and when he testifies he may be cross-examined on the whole case.",3,Rule/Law/Holding
16050,"R. 183, 177 S.W. 1161, the defendant pleaded guilty and took the witness stand to testify that he had never been convicted of a felony.",3,Rule/Law/Holding
16051,This court held that the state could cross-examine him as to the mode and manner of committing the offense.,3,Rule/Law/Holding
16052,"It would do violence to the intent of the legislature and to the holdings mentioned to hold that the pleading of the defendant would suffice as proof that he had never been convicted of a felony, thereby relieving him of the necessity of testifying as a witness or of offering the evidence of other witnesses who could be cross-examined.",3,Rule/Law/Holding
16053,"In the same bill of exception, appellant raised another proposition or contention, maintaining that the trial court materially erred in charging the jury upon the law of principals.",2,Issue
16054,He first says that there was no evidence to support the charge and that it was a comment upon the weight of the evidence.,4,Analysis
16055,He further contends that the issue of his guilt was submitted to the jury upon two separate factual theories; that the jury returned a general verdict of guilty; and that there was no way of ascertaining upon which one of the two theories the jury found him guilty.,2,Issue
16056,Appellant’s contentions are without merit.,4,Analysis
16058,"We further think that the evidence is abundantly sufficient to support either theory of the state as to appellant’s guilt, whether it be as a principal with his companions or as an individual offender.",4,Analysis
16059,"Appellant’s contentions are overruled, and the judgment is affirmed.",4,Analysis
16060,"Appellant was tried in the County Court of Cochran County, before a special judge and a jury, upon complaint and information alleging that he committed an aggravated assault upon Raymond Kuykendall, a special deputy sheriff who was in the discharge of his official duties.",1,Facts
16061,"Appellant sought to have the jury instructed to acquit if they found that Kuykendall was not a special deputy sheriff discharging his official duties, but the court submitted both aggravated assault and simple assault.",1,Facts
16062,"The judgment rendered and entered recites that the following verdict was returned and entered: “We, the jury, find the defendant Ed Workman guilty, and assess a fine of $25.00 and Court cost of $58.30.”",5,Conclusion
16063,"Following this verdict, the judgment from which this appeal is prosecuted recites:",7,Invalid sentences
16064,The judgment rendered in effect upheld appellant’s contention that he was entitled to acquittal if not found guilty of aggravated assault.,4,Analysis
16065,"In any event, the judgment appearing in the transcript is not a judgment of conviction from which an appeal may be taken to this court.",4,Analysis
16067,"“It is therefore considered, ordered, and adjudged by the court that the defendant, Ed Workman, be immediately discharged from all further liability upon the charge for which he has herein been tried and that he go hence without day.”",5,Conclusion
16068,"The conviction is for negligent homicide in the first degree; the punishment, nine months in jail.",2,Issue
16069,"The information alleged that the appelant, while lawfully",7,Invalid sentences
16070,"It is undisputed that the automobile appellant was driving east on the south side of an east-west expressway struck the south curb, then travelled to the left striking a traffic island six to eight inches high and from two and one-half to three feet wide, overturned and came to rest partly on the island and partly in the south lane of the two lanes on the north side; and that the automobile traveling west, in which the deceased was riding as a passenger, skidded thirty-nine feet before striking appellant’s automobile resulting in the deceased’s death.",1,Facts
16071,The proof fails to correspond with and support the material allegations in the information.,4,Analysis
16072,"All the evidence, both for the state and the appellant, shows that the appellant did not, as alleged, drive his automobile into and against Gary Wilks thereby inflicting serious bodily injury restulting in his death.",4,Analysis
16073,The failure of the proof introduced to support the material allegations in the information calls for a reversal.,4,Analysis
16076,The sole contention presented on appeal is that the court erred in failing to charge on the law of circumstantial evidence.,4,Analysis
16077,"For this reason, the facts will have to be stated more fully than we would normally do.",6,Others
16078,"Detective Privett of the Lubbock police testified that on the day in question he was concealed, along with the park’s policeman Barnett, in a tool shed which opened into a latrine located in one of the city parks; that both he and Barnett were observing the inside of the latrine through holes in the door; that appellant came in and waited around a while without availing himself of the facilities of the latrine until a man, whom he later determined to be named Pelton, entered and very shortly thereafter lowered his trousers, pulled up his shirt, and bent over holding on to his ankles, and since he was not wearing underclothes this left his entire rectal area exposed.",1,Facts
16079,"He stated that Pelton said to appellant, “Be sure and get it hard because it’s no good .",1,Facts
16080,unless it is hardthat appellant finally said “it was hard enough”; that both men were facing away from him at the time and he saw appellant’s hips move in and out but that Pelton remained still; and that appellant was immediately behind Pelton in a standing position “so close * * * that his stomach was up against the back of * * * Pelton.”,1,Facts
16081,"He testified that after they had observed this conduct for a short time he and Barnett burst out into the latrine, at which time he saw appellant’s sex organ in an upright position as he withdrew from “bodily contact” with Pelton, that Pelton’s rectum “was red and looked like it was turned wrong side out,” and likened it to the rectum of a horse immediately after discharging waste matter.",1,Facts
16083,"On cross-examination, he admitted that he did not see appellant's private penetrate Pelton’s rectum, because they both had their backs to him, but he did testify to bodily contact between the parties, and that appellant’s penis was “very muchly erected.”",1,Facts
16084,His version of their conversation was that Pelton told appellant he would have to watch out as he was unable to see out from his,7,Invalid sentences
16085,"Appellant, testifying in his own behalf, stated that while on his way from home to work he drove through the park and stopped at the latrine to relieve himself; that the man, who he had never seen before but whom he later learned to be Pelton, came in and made the proposal that he have intercourse with him in the rectum; that he declined, saying that his penis was not hard; that a short while thereafter Pelton inquired of it was hard yet and dropped his pants, at which time the officers arrived.",1,Facts
16086,He denied that he touched Pelton or that his penis had been erect.,1,Facts
16087,He offered his wife and another reputation witness.,1,Facts
16088,We have stated the facts more fully than usual in order to demonstrate that penetration was proven by direct evidence and that the requested charge was not required under the facts.,1,Facts
16090,"No reason exists why the rule should not apply to a sodomy case such as the one before us where the victim of the lust is a young boy, 13 years of age, when the acts are committed.",4,Analysis
16091,"R. 164r 261 S.W. 2d 836, relied upon by appellant is not here controlling because in that case the prior acts of sodomy were upon two boys who were not present when the offense of indecent exposure to another boy for which the accused was being tried was committed.",3,Rule/Law/Holding
16093,"Appellant next insists that the court’s charge was fundamentally erroneous because the abstract definition of the offense given by the court informed the jury that certain acts, not charged in the indictment, would constitute the offense.",1,Facts
16094,No objections were made by appellant to the charge nor were any requested charges presented to the court.,1,Facts
16095,The indictment charged that appellant committed oral sodomy upon the prosecuting witness.,1,Facts
16096,"While the court defined the offense under that portion of Art. 524, V.A.C.C.P., which provides that “Whoever has carnal copulation * * * in an opening of the body, except sexual parts, with another human being, * * * shall be guilty of sodomy * * the court did make a direct and pertinent application of the law to the case as alleged in the indictment and made by the facts.",3,Rule/Law/Holding
16097,"Under the court’s instruction, the jury was requested, before convicting the appellant, to find from the evidence beyond a reasonable doubt that he did have carnal copulation with the prosecuting witness by using his mouth on his sexual parts.",1,Facts
16098,Such instruction required a finding by the jury of the constituent elements of the offense of oral sodomy as charged in the indictment and the charge does not present fundamental error.,1,Facts
16099,We overrule appellant’s remaining contention that the evidence is insufficient to show that the offense was committed within the period of limitation.,1,Facts
16100,The limitation period for the offense of sodomy is three years.,1,Facts
16101,"The indictment was presented against the appellant on April 20, 1959.",1,Facts
16102,The testimony of the injured party that he first met the appellant “around,7,Invalid sentences
16105,Appellant was convicted of the offense of sodomy and his punishment assessed at confinement in the penitentiary for 15 years.,4,Analysis
16106,"After trial, sentence, and notice of appeal to this court, appellant was adjudged insane and committed to a state hospital.",1,Facts
16107,"Upon motion of appellant’s counsel, all further proceedings in this court were suspended and the cause was ordered retired from the docket until it should be properly shown that appellant had been restored to sanity.",1,Facts
16108,"It is now shown by judgment duly entered in the Criminal District Court of Dallas County that appellant has been restored to sanity and, upon motion of the state, the cause is ordered reinstated upon the docket for further proceedings.",1,Facts
16109,"The prosecuting witness, a young boy 15 years of age at the",1,Facts
16110,"Appellant’s written confession was'introduced in evidence by the state in which he stated that he first met the prosecuting witness in December 1957 and that, in February or March 1958, he began having him come to his farm in Seagoville for week end visits.",1,Facts
16111,Appellant admitted in the confession that upon the occasion of several of the visits he fondled the private parts of the prosecuting witness and on one occasion committed an act of sodomy upon him.,1,Facts
16112,Appellant did not testify but called his brother as a witness who testified that appellant had been under the treatment of a psychiatrist.,1,Facts
16113,"Appellant insists that the court erred in permitting the state to introduce, as original evidence, proof that he had committed the extraneous offense of fondling upon the prosecuting witness in Lufkin prior to March 1958, when the alleged act of sodomy occurred.",2,Issue
16114,"R. 503, 236 S.W. 2d 820, this court held that, in cases involving incest and rape under the age of consent, acts other than the one charged in the indictment were admissible as evidencing the probability of the charged act and the unnaturalness of the accused’s attitude toward the victim of his lust.",7,Invalid sentences
16115,The Johns case was followed in Gephart v.,7,Invalid sentences
16116,The appeal is from a conviction for violation of an ordinance of the city of Marshall.,1,Facts
16117,The prosecution arose in the corporation court where appellant was found guilty and assessed a $200 fine.,1,Facts
16118,He appealed to the county court and the trial resulted in a like fine being assessed by the jury.,1,Facts
16119,"The ordinance provides: “It shall be unlawful for any peddler, salesman, solicitor, or any other person who goes on the premises of another person, to remain on such premises after he has been ordered by any lawful occupant to leave such premises.”",1,Facts
16120,"The punishment for violation of said ordinance is found in the following section of the Code of Ordinances of the city of Marshall: “It shall be unlawful for any person to violate or fail to comply with any provision of this code, and where no specific penalty is provided therefor, the violation of any provision of this code shall be a fine not exceeding two hundred dollars; provided, where such fine is for an offense for which the state law",3,Rule/Law/Holding
16121,Appellant filed various exceptions and motions to quash the complaint which were overruled.,1,Facts
16122,"On appeal he attacks the ordinance as unconstitutional for several reasons; and attacks the complaint, both because of the invalidity of the ordinance and the insufficiency of said complaint to charge a violation thereof.",1,Facts
16123,"A state statute, Art. 479 P.C., provides: “Any peddler or hawker of goods or merchandise who enters upon premises owned or leased by another and wilfully refuses to leave said premises after having been notified by the owner or possessor of said premises or his agent, to leave the same, shall be fined not less than one nor more than twenty-five dollars.”",3,Rule/Law/Holding
16189,"You are not saying that you didn’t do wrong, you are just saying that you didn’t get caught?",1,Facts
16265,The first count charged negligent homicide in the first degree.,1,Facts
16124,"Under this statute, as well as under the ordinance in question, the maximum punishment which may be meted out to a peddler who enters the premises of another and refuses to leave, after being notified or ordered to do so by one in lawful occupancy of said premises, is a fine of $25.00; whereas the ordinance provides that “any other person” (one who is not a peddler, salesman or solicitor) may be fined $200.00 for the same act and failure.",3,Rule/Law/Holding
16125,"Article 1, Section 3 of the Constitution of Texas and the 14th Amendment to the Constitution of the United States secure to all persons similarly circumstanced equal protection under the laws of this state or any subdivision thereof, and it is a well settled rule in all jurisdictions that a penal ordinance of municipal corporation constitutes state action subject to these fundamental provisions of the state and federal constitutions.",3,Rule/Law/Holding
16126,"As these provisions have been construed by the highest courts of this state as well as by the Supreme Court of the United States, a state law is not repugnant to either constitutional provision so long as unequal treatment of persons is based upon a reasonable and substantial classification of persons.",4,Analysis
16127,Unequal treatment of persons under a state law which is founded upon unreasonable and unsubstantial classification constitutes discriminatory state action and violates both the state and federal constitutions.,4,Analysis
16128,"Barbier v. Connolly, 113 U.S. 27, 5 S. Ct. 357, 28 L. Ed. 923; Williams v. Arkansas, 217 U.S. 79, 30 S. Ct. 493, 54 L. Ed. 673; Baccus v. Louisiana, 232 U.S. 334, 34 S. Ct. 439, 58 L. Ed. 627; McCloskey v. Tobin, 252 U.S. 107, 40 S. Ct. 306, 64 L. Ed. 481; Truax v. Corrigan, 257 U.S. 312, 42 S. Ct. 124, 66 L. Ed. 254; Breard v. Alexandria, 341 U.S. 622, 71 S. Ct. 920, 95 L. Ed. 1233; Stans",3,Rule/Law/Holding
16129,"There appears no reasonable and substantial classification of persons which justifies the imposition of a $25.00 fine upon peddlers, salesmen, and solicitors and a $200 fine upon all other persons for the same act.",4,Analysis
16130,"For the reasons stated, the ordinance is void and the conviction thereunder cannot be sustained.",5,Conclusion
16131,The judgment is reversed and the prosecution is ordered dismissed.,5,Conclusion
16132,"The offense is burglary, with two prior convictions for felonies less than capital alleged for enhancement; the punishment, life imprisonment under Art. 63, V.A.C.C.P.",2,Issue
16133,"The state’s evidence shows that the prosecuting witness, Dennis Osborn, lived with his family at 5913 Stones Throw in the City of Houston.",1,Facts
16134,Appellant worked for him in his construction business.,1,Facts
16135,"Osborn testified that, on the date alleged, when he returned home with his family from a Colorado vacation and drove into the driveway, he saw appellant’s automobile backed up to the garage with the trunk lid open and appellant standing inside the garage; that when appellant saw him he ducked through a door into the back yard; that he proceeded to appellant’s automobile and observed three guns in the open trunk, being two rifles and a shot gun, which he identified as his guns that he had left locked in a gun case in his home.",1,Facts
16136,The witness testified that he then proceeded inside the house and found that a gun case in the den had been broken open and “there were marks on the wood where it had been pried open with some object.”,1,Facts
16137,He testified that he then discovered that the door of the house between the patio and back yard had been pried open and “there were scratches where it had been pried open.”,1,Facts
16138,The witness testified that appellant then reappeared on the scene with another of his guns which also was missing and stated that he found it in the back yard; that appellant stated he did not know how the guns got in his automobile and that he had been out hunting for the witness’ dog.,1,Facts
16139,The witness further testified that he did not give the appellant permission to break and enter his house and take any property therefrom.,1,Facts
16140,"It was shown by the testimony of Officer H. L. Sherrouse, who went to the scene and investigated the burglary, that a screw",7,Invalid sentences
16141,"In proof of the two prior convictions, the state offered in evidence certain official court records and certain authenticated records of the Texas Prison System.",1,Facts
16142,"Included in the prison records were certified copies of the indictment, judgment, and sentence in Cause No. 61808, Styled The State of Texas v. Marion Todd, on the docket of Criminal District Court No. 2 of Harris County which showed that on October 17, 1949, the defendant therein was convicted in said court of the offense of burglary and certified copies of the indictment, judgment, and sentence in Cause No. 70168, styled The State of Texas v. Marion Earl Todd, on the docket of Criminal District Court No. 3 of Harris County which showed that on November 3, 1953, the defendant therein was convicted in said court of the offense of felony theft.",3,Rule/Law/Holding
16143,"Also included in the prison records were fingerprints of the convict named therein, Marion Earl Todd, No. 127645.",1,Facts
16180,"They testified that the screen door to the hallway was held closed by a spring and, further, that some time thereafter they identified appellant in a police lineup.",1,Facts
16144,"Officer Jim Ballew of the Identification Division of the Harris County Sheriff’s Office, upon being called as a witness by the state, testified that he had taken a set of fingerprints from the appellant which he had compared with the fingerprints contained in the prison records and expressed his expert opinion that they were of the same person.",1,Facts
16145,Proof was made that the two prior convictions were final convictions and that the offense for which appellant was convicted in 1953 was committed after appellant’s first conviction in 1949 had become final.,1,Facts
16147,We first overrule appellant’s contention that the court erred in permitting the state to prove the two prior alleged convictions by offering in evidence the authenticated prison records and the expert opinion evidence of Officer Ballew as to his comparison of fingerprints.,4,Analysis
16148,Such method of proving prior convictions has been approved by this Court.,1,Facts
