id,text,label_id,label_text
16317,"The witness Renfro testified that a few days after the date charged in the indictment at his place of business in Nacogdoches he purchased a rifle from appellant, giving him a check therefor, and that he later delivered the same to the officers.",1,Facts
16318,The check payable to and endorsed by appellant was introduced in evidence.,1,Facts
16319,The prior convictions were stipulated.,6,Others
16321,The question of jury separation sought to be raised in the statement of facts does not reflect error.,4,Analysis
16323,"The offense is carrying a pistol, the punishment, 60 days in jail and a fine of $25.00.",1,Facts
16324,This exact question was before this court in Everett v.,6,Others
16325,"R. 262, 226 S.W. 2d 873, and we there held that the punishment assessed was not authorized by the statute and reversed the conviction.",3,Rule/Law/Holding
16326,"Upon a plea of guilty before the court without a jury, appellant was convicted of the offense of driving while intoxicated and his punishment assessed at 3 days in jail and a fine of $50.",1,Facts
16327,No statement of facts of any evidence adduced upon the trial accompanies the record.,1,Facts
16328,Appellant predicates his appeal upon the sole contention that there is a fatal variance between the complaint and information because in the complaint appellant’s name is alleged to be “William,7,Invalid sentences
16329,The contention is without merit as a middle initial may be,7,Invalid sentences
16332,This is a writ of error to review the final judgment in a bond forfeiture.,6,Others
16333,"The record sustains appellants’ contention that there was no service of citation upon either of them, for which reason the default judgment making final the forfeiture of the appearance bond upon which they are sureties is without support.",4,Analysis
16334,The state agrees and does not seek affirmance.,1,Facts
16335,The judgment making the judgment nisi final is reserved and the cause remanded.,5,Conclusion
16336,"The offense is burglary; the punishment, five years.",2,Issue
16340,MOTION FOR REHEARING,6,Others
16341,A statement of facts of the evidence adduced upon the appellant’s trial has been filed in this court and will now be considered.,1,Facts
16342,"The state’s evidence further shows that, in response to a call, Officers Gilbert and Wallace went to the liquor store shortly after 11 p.m. When they arrived they saw the appellant and two other men down the street some two-thirds of á block from the store.",4,Analysis
16343,"At such time, the appellant had a bottle in his pocket and one of the men was carrying a box.",1,Facts
16344,"As the officers approached, appellant and his companions ran and the officers gave pursuit.",1,Facts
16345,"Appellant was captured by Officer Gilbert after he had run upon a pile of lumber between two buildings and, at the time, had on his person a fifth bottle of V.",1,Facts
16346,O. Canadian Whiskey which he had opened and was attempting to pour the contents on the ground.,1,Facts
16347,"While in flight, the man carrying the box dropped it on the ground.",1,Facts
16348,"The box, when recovered by the officers, was found to be a case of Thunderbird Wine which the prosecuting witness identified by certain serial numbers thereon as the case of wine missing from his store.",1,Facts
16349,"Testifying in his own behalf, appellant denied breaking and entering the liquor store on the night in question.",1,Facts
16350,Appellant testified that before he was arrested he had been to a theatre; that after he came out “two guys started walking by meand that the reason he ran from the officers was because Officer Gilbert tried to run over him.,1,Facts
16351,He denied that at such time he was carrying a bottle of whiskey.,1,Facts
16352,"On cross-examination, appellant testified, without objection, that on January 27, 1959, he was convicted upon a plea of guilty in the same court of the burglary of another liquor store.",1,Facts
16353,Appellant filed no objections to the court’s charge but on appeal urges as fundamental error the court’s failure to limit the jury’s consideration of such testimony in the charge.,2,Issue
16354,Appellant relies upon the rule announced in the early cases of Burks v.,7,Invalid sentences
16355,"State, 25 Tex. App. 614, 8 S.W. 925, this court, in passing upon the trial court’s failure to instruct the jury as to the purpose for which certain testimony was admitted in the cause, said:",7,Invalid sentences
16356,"Under the record, we are unable to say that appellant was injured by the court’s failure to limit the jury’s consideration of the impeachment testimony and overrule the contention that such omission in the charge constituted fundamental error requiring a reversal of the conviction.",1,Facts
16357,"Appellant complains of the overruling of his objection to certain questions propounded to him on cross-examination by State’s counsel in which he was asked, in substance, if he was telling the jury that Officer Gilbert was lying and not telling the truth when he testified that appellant had the bottle of whiskey in his pocket.",1,Facts
16358,Appellant’s answer to the inquiry was in the affirmative.,1,Facts
16359,"While the questions were argumentative and appellant’s objection should have been sustained, under the record, the court’s ruling does not call for a reversal of the conviction.",1,Facts
16360,The issue of appellant’s guilt was submitted to the jury upon a charge on the law of principals and circumstantial evidence.,1,Facts
16363,“But it has never been held that such an omission in the charge is fundamental error which is necessarily fatal to the conviction.,1,Facts
16364,"When such error is for the first time called to the attention of the trial court in a motion for a new trial, this court will not reverse because of it, unless it appears, from the whole evidence adduced on the trial, that the defendant’s rights may have been injured in consequence of it.”",3,Rule/Law/Holding
