id,text,label_id,label_text
19978,* * * * I called Mrs. Downey and told her that I would like to bring some of Mike’s clothes over there as he had left them at my place.,1,Facts
20234,"* * *” This appeal, in effect, represented to the jury that appellant had not previously served time in jail for an offense.",1,Facts
20136,"“ ‘If there had been someone else in the car with the defendant, Judge Fletcher [appellant’s attorney] would have had him here.’ ”",1,Facts
19954,“Appellant takes issue with our statement in the original opinion that the holding in Rotner v.,7,Invalid sentences
20343,"“by inviting and encouraging and inducing him to go to a place in Harris County, Texas, said place being a place where intoxicating liquors were sold, and to partake of said intoxicating liquors by then and there buying for and giving to the said Edward Sandels said intoxicating liquors.”",1,Facts
20005,“Defendant duly sentenced.,1,Facts
20103,“I asked her to have intercourse with me and she said she was afraid her husband would come in.,1,Facts
19970,"“I believe that it was back last April of this year that I was with Robert ‘Mike’ Downey’s big brother and one night Mike, George ‘Pat’ Downey and David Hughes went to my home and I believe that it was at night I do not know the date but it was in April, after we arrived there I had a urge to see the boys without any clothes on so I asked them if they would pull off of their clothes.",1,Facts
19980,“I mean I took the pictures for the purpose of sex education.,1,Facts
19893,“The homicide must be the consequence of the act done or attempted to be done.”,3,Rule/Law/Holding
19953,“The omission from the caption of any notice of intention to change the penalty renders the amending act inoperative.”,1,Facts
20246,"“The other statement that I don’t think he need to say, ‘That you’re going to ruin this guy’s life by putting him over here in the jail.’ It’s a reasonable deduction since he went into this that this isn’t the first time this man has been in jail.”",4,Analysis
20105,"“The statements and conduct of prosecutrix said and done shortly after the transaction may be proved as original evidence if suffering excludes the idea of fabrication, and the statements or conduct are spontaneous and instinctive, and there is no break or let-down in the continuity of the transaction.",4,Analysis
19891,“There is nothing in the record to suggest that the collision would not have occurred with the same results had the truck been traveling at thirty miles per hour instead of thirty-five.,4,Analysis
19949,“There was a material change in the penalty.,1,Facts
20009,"• On January 3, Fred Beavers accompanied the appellant in his '55 red and cream or red and white Oldsmobile 88 automobile from Morton to Kermit to get their pay checks.",1,Facts
20202,"128; Sethman v. Liberty National Bank of Oklahoma City, Oklahoma, 55 S.W. 2d 644 (Civ. App.) writ dismissed.",3,Rule/Law/Holding
20007,"1957 in Harris County, Texas, been duly and legally convicted on 5 cases, and his punishment therefor having been assessed and adjudged at confinement in the penitentiary for 8 years, and he having on the 26th day of February, 1957, by said court, been sentenced in due form of law in accordance with said convictions, it is further considered, ordered and adjudged that the punishment herein adjudged against the said defendant John Leonard Lee, shall begin when the said judgments and sentences on the preceding convictions shall have ceased to operate.”",1,Facts
20098,"1958, which reads as follows:",1,Facts
20064,"21, 317 S.W. 2d 737, we held that a by-pass road under construction, closed to through traffic but being used by persons other than the contractor and the Highway Department, was a public road.",7,Invalid sentences
19924,"222, Regular Session of the 56th Legislature, page 504.",7,Invalid sentences
20371,"237, 312 S.W. 2d 517, held that when a motion for continuance was not sworn to personally by appellant, he could not complain of the action of the trial court in overruling the motion.",7,Invalid sentences
20173,"258, 262 S.W. 2d 488, this court held, the prosecution being for unlawfully possessing whisky and other alcoholic beverages for the purpose of sale in a dry area, that an officer’s reading to the jury labels on bottles of beer and whisky claimed to have been found in and about appellant’s house was not error when the appellant objected on the grounds of hearsay.",7,Invalid sentences
19929,"35 of our Constitution, which says, in substance, that no bill, with certain exceptions (being general appropriations bills) shall contain more than one subject, which shall be expressed in its title.",7,Invalid sentences
20125,"459, 314 S.W. 2d 605, the witness Monk testified that the man driving the Ford automobile involved in a collision with another car was the sole occupant thereof and that, following the collision, he saw this man “ ‘flying through the air’ ” and falling to the shoulder of the highway, where he lay motionless until the officers arrived.",1,Facts
20373,"488, 278 S.W. 2d 167, wherein it was held that where subpoena for a witness had not been issued, the overruling of the motion for continuance was not error.",7,Invalid sentences
19922,"508, 243 S.W. 2d 846, a death penalty conviction, we held no reversible error was reflected by argument not objected to where no mandatory provision of the statutes are violated and no new and harmful fact is injected into the case.",5,Conclusion
20193,"A litigant is not permitted during a trial on the merits to remain silent as to affirmative defenses known to him, and then when an adverse result is reached, on motion for new trial complain because of his own neglect.",1,Facts
19907,A prior death penalty conviction against this appellant was reversed because of certain jury misconduct and procedural errors.,1,Facts
20339,"A re-examination of the evidence shows, in addition to the facts set out in our original opinion, that the appellant owned the property where the barbecue and beer were sold, but that he had rented it to another person who was operating it.",4,Analysis
19878,A small portion of the front of appellant’s car struck a small portion of the right-hand side of the Smith car.,1,Facts
20275,"A. Knowles testified that shortly after midnight appellant ran a red light at an intersection where they were stopped, and almost hit the squad car; that they overtook appellant; that he had a very slurred speech and was very unsteady on his feet; his eyes were watery and bloodshot; there was a strong odor of alcohol on his breath and he said he had been drinking.",1,Facts
19998,"Acts done, statements and appearance of the participants, and other similar circumstances are all admissible as part of the res gestae when a witness narrates the events surrounding an offense.",4,Analysis
20052,"After carefully considering appellant’s three informal bills, we find no merit in any of them, and appellant’s contentions are denied.",5,Conclusion
20152,"After carefully reviewing the evidence, we find that appellant failed to introduce evidence upon which the jury could base",5,Conclusion
19974,After doing this awhile I got toy Polaroid camera and I took a picture of their privates.,1,Facts
20269,"After said request had been denied and the list of jurors chosen had been completed, and after some of the jurors had been called, counsel for the state discovered that he had struck only six names from the list whereas he had placed circled numbers from 1 to 6 opposite these six names and a circled number 7 opposite the name of the Juror Olivares, intending to strike his name also.",1,Facts
20076,"After the man left, the prosecutrix took her baby and went to a neighbor’s house across the street.",1,Facts
20223,"After the motion for mistrial was overruled, the prosecutor continued, “You are not going to degrade him and you’re not going to ruin his life.",1,Facts
19999,"All the cases cited by the appellant deal with photographs taken by others, not by the",7,Invalid sentences
20020,An officer delivered the check found in the Oldsmobile to Johnny Jordan in the sheriff’s office in Littlefield.,1,Facts
20006,"And the said defendant, John Leonard Lee, having on the 26th day of February, A.",7,Invalid sentences
20188,Another person whose name appeared on the bond as surety was discharged from liability by the court upon the trial.,1,Facts
20160,Any harm that was done was cured by the sub,7,Invalid sentences
20362,Appellant adduced no testimony other than his own.,1,Facts
20338,Appellant again urges his contention that the evidence is insufficient to support the conviction.,2,Issue
20086,Appellant also denied that the cigarette lighter and pencil found in her home belonged to him.,1,Facts
20050,Appellant also filed what he termed an “Exception Record.”,1,Facts
19911,"Appellant and his companion made both oral and written confessions, but appellant’s written confession was not introduced in evidence.",1,Facts
20169,"Appellant complains of the identification of the fifteen cases of wine, of the testimony as to the label, “Gypsy Rose,” on the bottles of wine, and of the making of the search, complaining that the wine was found as a result of an unauthorized search.",2,Issue
20033,"Appellant complains of the sheriff’s testimony that he gave the black hat found near the overturned Oldsmobile to “Mrs. Thomas, the boy’s mother, she came after it” over his objection that there was no evidence that it belonged to him.",2,Issue
20326,"Appellant concedes that, in charging the offense, such allegation was unnecessary but insists that, since the allegation was made, it became a descriptive averment in the State’s pleading which the State was required to prove under the rule stated in Ewing v.",7,Invalid sentences
19927,"Appellant contends that Art. 602, supra, under which he was tried and convicted, is unconstitutional because said article, as enacted by the Regular Session of the 56th Legislature, contains more than one subject —his contention being that the definition of acts which constitute a misdemeanor and the definition of acts which constitute a felony cover more than one subject.",2,Issue
20212,Appellant contends that the evidence is insufficient to sustain his conviction as a principal to the murder.,2,Issue
20161,Appellant contends that the state failed to prove that Smith County was a dry area and that the trial court erred in overruling his motion for an instructed verdict of “not guilty.”,2,Issue
20158,"Appellant contends that the trial court erred in overruling the objection to the testimony of the state’s witness Jernigan, to the effect that Smith County was a dry area.",2,Issue
20029,"Appellant contends that the trial court erred in refusing his motion-for a mistrial when it was discovered, after both sides had made their challenges but before the names of the jurors were called and they were empaneled, that one of the jurors selected was a member of the grand jury that returned the indictment against the appellant.",2,Issue
20369,"Appellant did not comply with the terms of Art. 540, V.A.C.C.P., which provides for the continuance of criminal actions on the written application of the state or of the defendant upon sufficient cause shown, which cause shall be fully set forth in the application.",4,Analysis
20121,"Appellant did not testify in his own behalf, but called his wife, who testified that they had come from Dallas to Grand Saline for a visit on the day in question and that when she last saw appellant that night she “wouldn’t say that he had been drinking or that he had,” that she didn’t know, but that she knew “he wasn’t drunk.”",1,Facts
20210,Appellant did not testify or offer any evidence in his behalf.,1,Facts
20153,"Appellant failed to bring himself under the terms of Art. 666-23a (1), which makes it lawful to transport intoxicants from a place where the sale thereof is legal to a place where the possession thereof is legal.",4,Analysis
20190,"Appellant filed an amended answer October 21, but therein",7,Invalid sentences
20053,Appellant filed no brief on appeal.,1,Facts
20183,"Appellant further asserts that we were in error in holding that the court did not err in failing to respond to his demand that he be shown a certain document, not then in the possession of the witness, but from which he had refreshed his memory at some undisclosed time in the past.",2,Issue
19928,Appellant further contends that the caption of the act amending the statute in question omits mentioning an intent to change the penalty provided for in the body of the act. It is appellant’s position that these contentions advanced by him make the act unconstitutional as being contrary to Art. 3 of Sec.,7,Invalid sentences
20199,"Appellant insists that his verified amended answer, in which he challenged the validity of the bond together with his sworn testimony given on the hearing of the verified motion for new",7,Invalid sentences
20325,"Appellant insists that the evidence is insufficient to sustain the conviction because it was not shown that he induced, enticed or encouraged the minor to go to the place where intoxicating liquor was sold as alleged in the information.",1,Facts
19981,Appellant insists that the trial court erred in admitting in evidence the two nude pictures of the prosecuting witness and his companion because they solved no issue in view of his plea of guilty and were inflammatory and prejudicial.,2,Issue
20024,Appellant lived with his mother about one or one and one-half blocks from where the car was parked.,1,Facts
20155,"Appellant next complains of the trial court’s refusal to require a state’s witness to furnish a copy of what is referred to herein as a “Poop Sheet,” explained as being a written form completed at the time of appellant’s arrest and setting out some of the details of the case, including appellant’s name, the offense with which he was charged, the date of the offense, and facts indicating the commission of the offense for which he was arrested.",2,Issue
20216,Appellant next contends that the confession contained exculpatory statements in that it shows that when Alfred and Ramon Gonzales first entered appellant’s car he was told that he need not know what they were going to do and that the trial,2,Issue
20124,Appellant next contends that the court erred in failing to charge on the law of circumstantial evidence.,2,Issue
20093,Appellant predicates his appeal upon certain informal bills of exception appearing in the statement of facts.,1,Facts
20048,Appellant presents three formal bills of exception in a supplemental transcript.,1,Facts
19936,Appellant relies upon Rotner v.,7,Invalid sentences
20087,"Appellant repudiated that portion of his confession in which he admitted going to her home and also, by his testimony, raised an issue as to the voluntary nature of the confession.",1,Facts
20182,Appellant strenuously argues that reversible error is reflected by the answer of Officer Williams to the question as to why he,7,Invalid sentences
20368,Appellant subpoenaed no witnesses.,1,Facts
20308,"Appellant testified and offered evidence from other witnesses to the effect that he consumed two “martinis” shortly before his arrest, but that he was not intoxicated.",1,Facts
20088,"Appellant testified in substance that he was at his home at the time the rape was committed and called his wife, who corroborated his testimony.",1,Facts
20089,Appellant testified in support of his application for suspension of sentence that he had never been convicted of a felony and called witnesses who attested his good reputation for being a peaceable and law abiding citizen.,1,Facts
20280,"Appellant testified that he consumed five twelve ounce bottles of beer between 8:30 and 11:30 P.M. prior to his arrest, but denied that he was intoxicated.",1,Facts
20324,"Appellant testified that the boy said he was “old enough” to drink, that he looked like a “big boy,” and, had he known the boy was only fourteen, he would not have “sold” him the beer.",1,Facts
20360,Appellant took the stand in his own behalf and testified that he was not drunk; that he had had “three beers” on the occasion in question.,2,Issue
19986,Appellant urges error because of the failure of the trial court to admonish him at the time he entered his plea of guilty as to the consequences of such plea.,2,Issue
19871,"Appellant was convicted in the county court of Shelby County for negligent homicide in the second degree, with punishment assessed at a fine of $150.",2,Issue
20140,"Appellant was convicted in the county court of Smith County of the offense of transporting an alcoholic beverage, to-wit, wine, in a dry area.",1,Facts
20108,"Appellant was convicted in the county court of Van Zandt Countjr for driving a motor vehicle on a public road, while intoxicated.",2,Issue
19923,"Appellant was convicted of the misdemeanor offense of wilfully deserting, neglecting, or refusing to provide for the support and maintenance of his children under eighteen years of age, in violation of Art. 602, V.A.P.C., as amended by Senate Bill 47, Chap.",2,Issue
19874,"Appellant was driving his automobile, at nighttime, on a public highway, from Center toward Logansport, Louisiana, in a northerly direction, and the other car, driven by a Mr. Smith, was coming toward Center in a southerly direction, at the time of the accident.",1,Facts
20215,"Appellant was present at the commission of the offense in the sense that “present” is used in Article 66 and 69, V.A.P.C., and we find the evidence sufficient to sustain the conviction.",5,Conclusion
20146,Appellant was put in the patrol car and was taken by Officer Williams into Tyler to the sheriff’s office.,1,Facts
20047,"Appellant, his wife, and a friend each testified that the beer was bought either for appellant’s own use or for som.e friends for whom a party was to be given.",1,Facts
20293,"Appellant, testifying in his own behalf, admitted the argument with Oscar about the broken window, stated that he asked Oscar and Jimmy Ann to leave, but that Jimmy Ann knocked over his soda water cases and began to shove his candy case when he shot her.",1,Facts
20370,Appellant’s application was made orally.,1,Facts
19912,"Appellant’s companion, who was serving a life sentence for the crime in question, testified fully as to appellant’s participation therein.",1,Facts
20217,Appellant’s confession also states that at the time Alfred and Ramon got out of his car near the service station he knew they intended to rob the station operator and he expected to get his share of the money; therefore the confession as a whole shows that there were no exculpatory statements which would demand uppelant’s requested charge.,5,Conclusion
20209,Appellant’s confession was introduced into evidence by the state which recites that on the date in question he drove his car to the home of Alfred and Ramon Gonzales; that Alfred asked him to take them to a filling station and he replied that he,7,Invalid sentences
20232,"Appellant’s counsel, who the evidence shows was the roomate of the appellant’s in their school days, had argued: “Make no mistake about the fact that you have ruined his life if you find him guilty because he has to go to jail.",1,Facts
20132,Appellant’s last complaint is that the prosecutor went outside the record when he stated that Dr. Cosby released appellant to the officers so that he might be taken to jail.,2,Issue
19921,Appellant’s last complaint relates to argument.,1,Facts
20025,"Appellant’s mother testified that appellant was wearing a black hat on January 3 but was not wearing a hat when he came home about 7 A.M., January 4, bloody and with a cut on his head; that she called an ambulance which took him to the hospital; and that she next saw her son’s black hat a few days later in the sheriff’s office and took it home.",1,Facts
19917,Appellant’s next complaint requires a more thorough discussion of the facts.,1,Facts
20316,Appellant’s sole contention on appeal is that the evidence is insufficient to support the conviction.,2,Issue
20194,"Appellant’s waiver of service of citation, his appearance and participation in the trial on the merits, followed by his denial for the first time in his motion for new trial that he signed the bond, but without stating any excuse or justification for failing to raise such issue before, does not show any error in the refusal of the motion.",4,Analysis
19947,Art. 3 of Section 35 of the Texas Constitution does not prohibit the enactment of a bill making the first offense a misdemeanor and subsequent convictions a felony.,4,Analysis
20328,"Art. 534, V.A.P.C., makes it unlawful for a person by any act to contribute to the delinquency of a minor child under the age of seventeen years.",3,Rule/Law/Holding
19935,"Art. 602-A is identical to Art. 602, except that Art. 602-A makes a subsequent offense a felony, so the question here presented is whether the caption of Senate Bill 47, as passed by the Regular Session of the 56th Legislature, was sufficiently broad to authorize the enactment hereinabove summarized.",2,Issue
19901,"Article 52-87a2, C.C.P., provides that the above named courts shall have and exercise concurrent jurisdiction with each other in all felony cases, and in all matters and proceedings of which the said Criminal District Court of Tarrant County originally had jurisdiction; and either of said judges of said Criminal District Courts may in their discretion, by proper order, transfer any cause that may at any time be pending in his court to the other Criminal District Court.",3,Rule/Law/Holding
19888,"As shown by Judge Woodley’s opinion, it was alleged in the Hubbard case that appellant was driving thirty-five miles an hour in a thirty-mile zone at the time of the collision which resulted in the death of a passenger in the other car.",3,Rule/Law/Holding
19940,"As stated by Judge Christian in the Rotner case, supra:",6,Others
20225,"As stated, we find nothing in the record to authorize the “reasonable deduction” of the prosecutor that appellant had prior to the commission of this offense been confined in jail on other charges.",5,Conclusion
20249,"As the officer stopped the patrol car he was driving along side of the parked car, a man was walking across the street from the direction of the drug store to the car and got in on the driver’s side.",1,Facts
19945,"As to the case at bar, the caption of the act gives notice that the purpose of the proposed enactment was to add a new article, define the offense, fix a penalty, provide for subsequent convictions, and for a conviction for desertion by leaving the state.",3,Rule/Law/Holding
20021,"At approximately 7 A.M. January 4, the Hatcher car with dirt and trash on the front seat was found on a street in Little-field.",1,Facts
20012,"At this time, the temperature was 4 degrees below zero.",1,Facts
20185,Attention is directed to the holdings of this Court in Angle v.,7,Invalid sentences
20010,Beavers also obtained a check belonging to Johnny Jordan who lived in Little-,7,Invalid sentences
20130,"Bill of exception No. 5, which was approved by the court, complains of the following argument:",1,Facts
19937,"Both cases cited by appellant involved the same act and caption —namely, Art. 1316 of the Penal Code, which was “An Act to amend Article 1316, Chapter 1, Title 17, of the Penal Code of 1925; further defining the offense of an attempt to commit arson; and declaring an emergency.”",4,Analysis
20082,"Both statements were introduced in evidence, certain incriminating portions being offered by the state and other portions of an exculpatory nature being offered by the appellant.",1,Facts
19931,"Briefly, Art. 602, as enacted by the Regular Session of the 56th Legislature, defines the offense of wilfully deserting, neglecting, or refusing to provide for the support and maintenance of a wife in necessitous circumstances and the offense by either parent of wilfully deserting, neglecting, or refusing to provide for the support and maintenance of a child or children under eighteen years of age.",3,Rule/Law/Holding
19963,"But, a search of the record fails to reveal anything authorizing a review of such contentions.",1,Facts
20128,"By bill of exception No. 4, appellant complains of that portion of the prosecutor’s argument in which he said:",1,Facts
20283,By brief and oral argument appellant contends that there was fundamental error in regard to the proof regarding the intoximeter test.,2,Issue
20149,"By brief and oral argument, appellant’s very able counsel urges his contentions.",1,Facts
19982,By entering a plea of guilty the accused cannot restrict the right of the state to introduce relevant evidence showing the commission of the offense with which he is charged.,3,Rule/Law/Holding
20151,"By his first bill of exception, appellant contends that the trial court erred in overruling his exceptions and objections to the court’s charge, for the reason that the court failed “to charge the jury relative to the defensive matter and issue in this case,” and further complaint is made of the failure of the court to “instruct the jury relative to all of the issues involved in this case” and “to submit to the jury the defensive issues raised.”",2,Issue
20094,"By Informal Bill of Exception No. V, appellant complains of the court’s action in permitting the prosecutrix’ husband to testify as to what his wife related to him, at the neighbor’s house on the night in question, concerning the attack upon her over appellant’s objection that such was hearsay and not a part of the res gestae.",1,Facts
