id,text,label_id,label_text
20228,"By this unsworn statement, the prosecutor got before the jury evidence which was outside the record and extremely harmful to accused.",1,Facts
20068,"Cal., May 18, 1961, the roadways on McClellan Air Force Base in California were held to be highways under the State Statute defining drunken driving.",3,Rule/Law/Holding
20084,"Certain clothing of appellant was introduced in evidence, including a pair of white pants, a white shirt, and a pair of shorts worn by the appellant which, upon being examined by Chemist Charles Smith of the Texas Department of Public Safety, was found to contain seminal stains thereon.",1,Facts
20107,Citing authorities.,6,Others
20133,"Dr. Cosby testified that he treated appellant at the hospital, and Patrolman Johnson testified that he received permission at the hospital to bring appellant to jail.",1,Facts
20292,"Dr. Goodall testified that Jimmy Ann was brought to his hospital on the night in question suffering from gunshot wounds, that he operated on her for three hours, and that she was in a critical condition.",1,Facts
20278,"Dr. Mason, Director of the Dallas City-County Criminal Investigation Laboratory, testified without objection that an analysis run at the Laboratory revealed that intoximeter test No. 443, identified also by information on the slip sealing it with the name of appellant and of Officers Holcomb, Jackson and Knowles, showed .208 percent alcohol concentration in the blood.",1,Facts
20351,"Driving while intoxicated upon a public highway is the offense, with punishment assessed at a fine of $50 and three days’ confinement in jail.",2,Issue
20112,E. Bailey (shown to be no relation to appellant) testified that he was riding with Police Chief Pat Heddin on the night in question and that when they drove out the Alba Road they “found a car turned over in the ditch and a man lying about eight or ten feet from it.”,1,Facts
20139,E. Bailey did communicate that information to the officer.’ ”,7,Invalid sentences
20137,"E. Bailey, that the Defendant before he was arrested told him that there was no one in the car with him at the time of the collision and that M.",1,Facts
20138,"E. Bailey, the witness, communicated this fact to Pat Heddin, the officer, and that it was undisputed that M.",7,Invalid sentences
20359,E. Darland and his wife testified that they observed appellant after the accident and that it was their opinion that he was intoxicated.,7,Invalid sentences
20354,"E. Darland, whose wife and baby were the other occupants of the car.",7,Invalid sentences
20320,"Edward Sandies, the minor named in the information, a boy 14-years of age, testified that, on the night in question, he went to the place to buy a bottle of beer; that, when he arrived, he gave appellant a quarter and appellant brought him a bottle of beer.",1,Facts
20038,"Except for the opening sentence, the charge on circumstantial evidence is identical with that found in 1 Branch 2d 395, Sec.",4,Analysis
20366,"Finally, appellant complains that the evidence was not sufficient to support the verdict.",2,Issue
20179,"Finally, we conclude that had the search resulting in the finding of the wine been unauthorized it was incumbent upon appellant to have objected to the evidence when it was offered —that is, to the introduction of the fifteen cases of wine.",5,Conclusion
20374,"Finding no reversible error, the judgment of the trial court is affirmed.",5,Conclusion
20252,"Finding the door facing the street where he had seen the man walking had been pried open, the officer pursued and overtook the automobile, notifying the police dispatcher.",1,Facts
20101,"Finding the evidence sufficient to support the conviction, and no reversible error appearing, the judgment is affirmed.",5,Conclusion
20180,"Finding the evidence sufficient to sustain the jury’s verdict, and finding no reversible error, the judgment is affirmed.",5,Conclusion
20034,"Following the admission of the above testimony of the sheriff, the state called Mrs. Thomas, appellant’s mother, and she testified that the appellant was wearing a black hat on January 3 but was not wearing a hat when he came home about 7 A.M. January 4 and she next saw her son’s black hat a few days later in the sheriff’s office and took it home.",4,Analysis
20230,"For the error pointed out, the judgment is reversed and the cause is remanded.",5,Conclusion
20037,"From an examination of the court’s charge as given, appellant’s objections thereto cannot be sustained.",5,Conclusion
20178,"Furthermore, appellant admitted possession of the wine, by his own testimony.",4,Analysis
19918,He alleges that the court erred in admitting the oral confession of appellant which led to a discovery of the body of the deceased.,2,Issue
19896,"He entered into such appearance bond with Toby Goldsmith and Phil Becker as sureties, conditioned that Daniels make his personal appearance instanter before Criminal District Court of",7,Invalid sentences
20279,"He further testified that any individual having a concentration of alcohol in excess of .15 percent would be intoxicated, and that this had been lowered to .10 percent by more recent study and tests.",1,Facts
19967,"He further testified that at appelant’s request, he and the other boys removed their clothes and the appellant took pictures of them m the nude, and while testifying, he identified two of the pictures of himself and the other boy which were later introduced in evidence during the cross-examination of the appellant.",1,Facts
20322,"He further testified that, on such occasion, appellant was working at the place “taking or",7,Invalid sentences
20113,"He identified appellant as the man, and stated that, upon being asked if anyone was with him, appellant replied, “I was by myself.”",1,Facts
20294,"He stated, “I was intending to try to stop her from tearing up the place.",1,Facts
20111,"He testified that he searched the immediate area and found no other person, and that he remained at the scene until the ambulance came for appellant.",1,Facts
20291,"He testified that he, was not armed and made no effort to injure appellant.",1,Facts
20116,"Highway patrolman Tidwell testified that he went to the scene and found that an automobile had turned over “more than one time” and that he then went to the hospital, where he saw appellant.",1,Facts
19880,"Highway patrolman Vinyard testified, without objection, that in making an investigation he was able to judge the speed of the two vehicles at the time of the accident, his opinion being that appellant’s car was traveling at about sixty miles per hour but that he doubted that the car in which the deceased was riding was moving at any appreciable speed.",2,Issue
20281,His companion during those hours corroborated him.,1,Facts
20109,His punishment was assessed at a fine of $100 and confinement in jail for thirty days.,1,Facts
20032,"However, the record does not show that the appellant was prejudiced by the service of the next juror on the list.",1,Facts
20259,I agree to the affirmance of the conviction but see no necessity in overruling Giacona v.,7,Invalid sentences
19976,I also on this same night had a small plastic tube which I inserted in * * * of Mike and then I pulled it out.,1,Facts
19977,I don’t remember but I could have been playing with my peter also that night.,1,Facts
20224,I have been overruled on that.”,1,Facts
19972,I played with Mike and Pat’s peters but I don’t believe that I bothered David that night.,1,Facts
20245,I would affirm the conviction.,5,Conclusion
19973,I would put my hands on Mike’s and Pat’s peters and rub them and after awhile they would get hard.,1,Facts
20271,If either request was to be allowed it should have been that of defense counsel made before the lists showing the peremptory challenges had been compared.,1,Facts
20235,"If in fact the appellant had served one or more jail terms, it is apparent that the jury would have been misled by the argument that the jury would ruin his life if they convicted him because he would have to go to jail.",4,Analysis
20057,"If not, the conviction must be reversed for insufficient evidence.",1,Facts
20238,"If the objection to argument of state’s counsel is before us at all, it is by informal bill of exception under Art. 759a, Sec.",3,Rule/Law/Holding
19919,"Immediately upon their arrest, appellant and his companion McDade were taken to the courthouse, were placed in separate rooms, and were questioned by different teams of officers.",1,Facts
19996,"In addition to being admissible to show lascivious intent, the two exhibits were admissible as part of the res gestae.",4,Analysis
19952,"In changing the penalty, the bill went beyond the express limitation of its caption, and, under section 85 of article 3 of our Constitution and authorities, this destroyed its effectiveness as a law.”",4,Analysis
20177,"In disposing of the last contention made by appellant, being that the wine was found as a result of an unauthorized search, we think that the officers had probable cause to search appellant’s pickup truck.",4,Analysis
19946,"In enacting the article under which appellant was tried, the 56th Legislature did nothing more than carry out its purpose as announced in the caption of the act.",4,Analysis
19944,"In Garcia, the amendatory act made a felony",7,Invalid sentences
20221,"In his argument to the jury, appellant’s counsel urged them to acquit appellant because if they convicted him it would mean that he had to go to jail and that such fact would ruin his life.",4,Analysis
20222,"In his closing argument, the prosecutor said, “It’s a reasonable deduction, since he went into this, that this isn’t the first time this man has been in jail.”",1,Facts
20365,"In his motion for new trial, appellant complains of the court’s action is not granting him a continuance and in overruling his motion to hear the testimony of the witnesses for the state and then adjourn the trial of the case until the defense witnesses could be present in court.",2,Issue
20192,"In his motion for new trial, the appellant for the first time alleges that he did not sign the bond and upon the hearing thereon, he testified that he did not sign the bond, but would have authorized it if he had been called as he had done before.",2,Issue
19994,In his motion for rehearing appellant strenuously and ably insists that this court erred in holding state’s exhibits No. 1 and No. 2 admissible as bearing on the lascivious intent of the appellant.,2,Issue
20198,"In his motion for rehearing, appellant insists that we were in error in holding that the issue of his execution of the bond in question was not raised by a plea of non est factum.",2,Issue
20302,"In order to be considered by this court, a statement of facts must be agreed to by counsel for the state and appellant or approved by the trial judge.",3,Rule/Law/Holding
19957,"In the absence of a statement of facts, nothing is presented for review.",1,Facts
20165,"In the absence of a timely objection to the reading of a document to the jury, the parol and best-evidence rules have no application.",4,Analysis
20313,"In the absence of any showing of injury the error, if any, is not ground for reversal.",5,Conclusion
20284,"In the absence of objection to the admission of such evidence, there is nothing before us in this regard.",1,Facts
19916,"In the absence of the jury on the issue of probable cause, the court heard testimony from the officers concerning reports they had received about the Gandy truck having been abandoned in the residential section of Big Spring many miles away from its usual route; about the fact that Gandy did not employ colored drivers, but that two colored men were seen walking away from the truck as it was parked; about two colored men soon there",1,Facts
20018,"In the car, a check and a broken whisky bottle were found; there was blood on the windshield and dash and a man’s black hat was found nearby.",1,Facts
20260,"In the case at bar, the person of appellant was not searched and so the rule announced in Giacona has no application.",1,Facts
20083,"In the first statement, appellant admitted going on the two occasions to the service station where the prosecutrix’ husband was employed on the night in question but, in effect, denied going",1,Facts
20081,"In the investigation which ensued, appellant was questioned by the officers and, during the interrogation, made and signed two written statements.",1,Facts
20220,"In view of our disposition of this case, a recitation of the facts will not be deemed necessary other than to observe that there is no evidence in the record that appellant had ever before been convicted of any offense.",1,Facts
20004,"In view of the authorities heretofore cited, we hold that the relator is entitled to be discharged.",3,Rule/Law/Holding
20265,It certifies that the court refused to permit the defendant to change one of his peremptory challenges and strike the name of Mrs. Hardinger instead of another juror he had struck by mistake.,2,Issue
20254,"It is contended that the arrest of appellant was unlawful, and that the search of the automobile as an incident to such unlawful arrest was unlawful and the evidence obtained thereby was inadmissible under Art. 727a V.A.C.C.P.",2,Issue
19915,It is first contended that the court erred in permitting the introduction of the large sum of money found on appellant’s person following his arrest on the grounds that such arrest was illegal.,2,Issue
20267,"It is insisted that it was within the discretion of the court to refuse counsel’s request, and that no abuse of discretion is shown.",1,Facts
20131,"It is obvious from the argument set forth above that Officer Heddin, as well as appellant, might have disputed the testimony of the witness Bailey.",1,Facts
20164,It is to be noted that all this testimony was read into the record without objection.,1,Facts
20349,It is well settled that a conviction for theft by false pretext can be had upon such an indictment.,1,Facts
20240,"It provides in part that where by the argument complained of some new fact is thereby injected into the case the trial court, by qualification or otherwise, may require the bill of exception to reflect any reason whereby the argument complained of would not be error.",3,Rule/Law/Holding
20148,"It was appellant’s testimony that he had been to Kilgore, where he purchased the wine in question for the consumption of his farm hands, and that, when stopped by the officers, he was going back to his home in Tyler, Smith County.",1,Facts
20078,It was shown that appellant owned and operated a 1955 Chevrolet blue and white automobile with twin mirrors on the fenders and dual exhaust pipes.,1,Facts
19908,"It was shown that truck driver Canada was in the habit of carrying large sums of money on his person in the form of bills of large denomination; that he had a regular route from San Angelo to Sterling City, with intermediate stops, for the Gandy Milk Company; that he left San Angelo at 5:00 A.M., on the morning in question; that appellant and another colored man were seen to abandon Canada’s truck many miles farther north of Sterling City in the residential section of the city of Big Spring at approximately 8:30 A.M., on the morning in question.",1,Facts
19882,It was the witness’s testimony that he thought if appellant had been driving,7,Invalid sentences
20233,It’s not like — a murder without malice case where you can give him a suspended sentence# You’ve got to put him in jail and you’ve got to destroy him.,1,Facts
19939,Its purpose was clearly restricted to “further defining the offense of an attempt to commit arson.”,4,Analysis
20357,"J. Roberts, a policeman from the Terrell Hills Police Department, testified, as a witness for the state, that he was first to arrive at the scene of the accident; that he remained there for",7,Invalid sentences
20120,Jailer Morris testified that in his opinion appellant was “drunk” when he was brought to jail.,1,Facts
20287,"Jimmy Ann Davis testified that she was at appellant’s cafe on the night in question and that an argument erupted between appellant and one Oscar Davis, who was with her; that she sought to placate the men but that, in spite of her efforts, appellant cursed her, pulled out a pistol and shot at her twice, one bullet penetrating her stomach.",1,Facts
20195,Judgment is affirmed.,5,Conclusion
20122,"jury resolved such conflict as there was in the evidence against the appellant, and we find the evidence sufficient to support the conviction.",7,Invalid sentences
20297,"Minor testified that he shot over the head of the injured party, who he was seeking to arrest, not intending to hit him but for the purpose of scaring him into submission.",1,Facts
20310,No brief has been filed in appellant’s behalf.,1,Facts
19961,No further action pertaining to said purported bill is shown by the record.,1,Facts
19892,No other negligent act or omission on the part of appellant is shown save excessive speed.”,4,Analysis
20218,"No reversible error appearing, the judgment is affirmed.",5,Conclusion
19903,"Not being thus raised, the presumption of regularity obtains.",3,Rule/Law/Holding
19956,"Not having been approved as required by law, the statement of facts here is not subject to consideration by this Court.",1,Facts
20049,"Notice of appeal was given August 16, 1960, but formal bills of exception were not filed until November 22, 1960, which is more than the ninety days allowed for filing bills of exception under Art. 760d, V.A.C.C.P., and they cannot be considered by this court.",1,Facts
19962,Numerous contentions urging the commission of reversible error by the trial court are presented by brief and in oral argument upon submission of the case.,2,Issue
20067,"O’Sullivan v. Brown, 171 Fed. 2d 199, cited by appellant, may be distinguished by the fact that to enter the premises there in question one of the general public must arrange for a pass from the building manager or the Army personnel in charge, and once inside the grounds, the visitor is under military escort.",4,Analysis
20170,"Objection was also made to the reading by a witness from the label, and of the action of the court in admitting into the evidence state’s exhibits 1 through 15, which were the fifteen cases of wine.",2,Issue
20251,"Observing that the man started the car without difficulty and drove away, the officer noted the license number and checked the drug store which he had been informed someone had attempted to break into a week or ten days before.",1,Facts
20319,"Officer Anderson testified that he then went inside and, after he and appellant had come outside, appellant told him that the boy had given him a quarter to buy the beer.",1,Facts
20318,"Officer Otis A. Anderson of the Houston Police Department testified that, on the night in question, he went to a certain place at 8827 La Porte Road where barbecue and intoxicating liquors were sold; that, when he first arrived, he remained outside in his automobile where he could see through a door inside the building; that, while seated in the automobile, he saw the appellant inside the building hand a bottle of beer to the minor named in the information, who thereupon put the bottle to his mouth and then placed it on the table where he was sitting.",1,Facts
20143,"Officer Williams testified: “Well, I had the information that he was transporting, coming in out *",1,Facts
19975,On another night David Hughes and Mike Downey was at my house and I asked them to drop their pants and shorts which they did and I took three more pictures with my camera of their privates.,1,Facts
20337,ON appellant’s motion for rehearing,6,Others
19881,"On cross-examination, Patrolman Vinyard testified, also without objection, that he was not able to say that the five miles an hour in excess of the fifty-five miles per hour legal speed limit at nightime was the cause of the accident.",2,Issue
19897,"On February 14, 1961, judgment nisi forfeiting said bond was entered in Criminal District Court No. 2 of Tarrant County when said cause was called for trial and the defendant, Willie Mack Daniels, failed to appear.",1,Facts
20189,"On July 25, 1960 Jimmy Martin, as surety, signed an instrument which recited that he waived the issuance and service upon him of the scire facias and entered his appearance in said cause for all purpose.",1,Facts
20181,ON MOTION FOR REHEARING,6,Others
20080,"On the first occasion, appellant came to the station around 8 p.m., and purchased a Coca-Cola and, on the last occasion, around 1:05 a.m., when he purchased a package of cigarettes.",1,Facts
20079,"On the night in question, appellant drove into the service station where the prosecutrix’ husband was working on two occasions.",1,Facts
20236,"On the other .hand, if appellant had not served time in jail for an offense, the remarks complained of would be so prejudicial as to require that a mistrial be ordered.",4,Analysis
20264,One Bill of Exception is found in the record.,1,Facts
20342,Opinion approved by the Court.,5,Conclusion
20290,"Oscar Davis testified that appellant accused him of breaking one of the windows in the cafe, that he denied his guilt, that Jimmy Ann offered to pay for the window, and appellant reached in his pocket, pulled out a pistol and shot the injured party.",1,Facts
20205,Other grounds urged by appellant in his motion for rehearing were not presented in his brief on file herein upon the original hearing and are overruled.,5,Conclusion
20262,Our former opinion is withdrawn.,5,Conclusion
20119,"Patrolman Johnson, Tidwell’s partner, corroborated his testimony.",1,Facts
20248,"Police Officer Jack Scott, of Bellaire, saw an automobile parked near a drug store about 3:20 A.M. Appellant was sitting in the parked car.",1,Facts
20043,Police officers investigated and saw a case of beer in the back of the truck.,1,Facts
20333,Proof of such an act is sufficient to sustain the conviction.,5,Conclusion
19968,"Proof was offered of the making by the appellant, on July 17,1959, of a voluntary written statement to Deputy Sheriff McCurley pertaining to the offense charged and the boys involved in connection therewith which was introduced in evidence without objection.",1,Facts
20060,"R. 219, 49 S.W. 2d 783, 784, we said: “it would be intolerable to think that when investigating the criminal liability of the drunken driver of an automobile on a roadway, more or greater proof would be required to establish the character of the road, than that it was or is open for the use, or used by the public for traffic.”",7,Invalid sentences
20065,"R. 436, 307 S.W. 2d 948, we held that an unfinished area of a freeway being used by the public in general, though not designated and opened by the city, was a public highway within the meaning of Art. 802 V.A.P.C.",7,Invalid sentences
20061,"R. 480, 68 S.W. 2d 1044, the collision occurred on a highway which was under construction, gates having been built across it.",7,Invalid sentences
20066,"R. 98, 275 S.W. 2d 112, we held that a toll bridge which was open to the use of and was being used by the public as a highway and thoroughfare was a public road within the statute prohibiting drunken driving.",7,Invalid sentences
20239,relates to informal as well as formal bills of exception.,7,Invalid sentences
20296,Reliance is had upon Minor v.,7,Invalid sentences
20186,"Remaining convinced that we properly disposed of this cause originally, appellant’s motion for rehearing is overruled.",5,Conclusion
19898,"Scire facias, the citation, was issued and served on the sureties pursuant to the judgment nisi entered in Criminal District Court No. 2 of Tarrant County.",3,Rule/Law/Holding
20277,Sergeant Holcomb was contacted and an intoximeter test numbered 443 was taken with appellant’s consent.,1,Facts
20026,She further testified that her son had a red and white Oldsmobile but she did not see it when he came home about 7 A.M. January 4 and the next time she saw it was in Morton a few days later.,1,Facts
20074,"She further testified that the man appeared to have been drinking, was wearing white khaki clothing, and had bushy hair but that she could not identify appellant as the man.",1,Facts
20075,She further testified that the man left a cigarette lighter and a pencil in the bed.,1,Facts
20104,She laid down on the bed * * * but she did not try to push me off or put up any type of struggle.”,1,Facts
20073,"She stated that at such time she was scared and that, after the man left the house, she saw a 1955 blue and white Chevrolet automobile with a mirror on the fender and “loud tail pipes” drive out of the driveway.",1,Facts
20289,She testified further that after the shooting everyone fled the cafe and left her lying on the floor until the deputy sheriff arrived some thirty minutes later.,1,Facts
20288,She testified that she made no overt gesture toward appellant and that she was not armed.,1,Facts
20013,"Shortly thereafter, the Hatchers saw someone drive away in their 1958 Ford automobile which had been parked about thirty feet from their residence.",1,Facts
20063,"State, supra, it was held that the collision occurred on a public highway.",1,Facts
20334,"State, supra, the allegation that the whiskey was transported in a “2 door” automobile was descriptive of the identity of the unlawful act of which the accused was convicted and could not be rejected as surplusage.",1,Facts
19905,"subsequent proceedings had relative to the charge” in accordance with the provisions of Article 275a, V.A.C.C.P., does not, as appellant contends in his supplemental brief, vitiate the bond.",7,Invalid sentences
20085,"Testifying as a witness in his own behalf, appellant denied having gone to the home of prosecutrix on the night in question and having intercourse with her.",1,Facts
