id,text,label_id,label_text
20315,"Upon a trial before the court without a jury, appellant was convicted of the offense of unlawfully contributing to the delinquency of a minor and his punishment assessed at a fine of $300.",1,Facts
20017,"Upon an immediate investigation, a two-toned red and white ’55 Oldsmobile 88 automobile which had turned over several times was found by the side of the road near the curve about 80 yards from the Hatcher residence.",1,Facts
20022,W. R. Hatcher identified it as his car which he saw someone drive away from his place about 4 A.M. the same morning.,1,Facts
19887,"We agree with appellant’s able counsel and with our able state’s attorney that the Hubbard case, supra, controls, here.",1,Facts
20129,"We are cited no authority, and know of none, which would hold such argument to be a reference to appellant’s failure to testify, or to be reversible error.",2,Issue
20204,"We are unable to agree with appellant that the state, by failing to object to his testimony given on the hearing of the motion for new trial denying execution of the bond, waived the requirements of a plea of non est factum in the cause.",5,Conclusion
20272,We conclude that the court abused his discretion in refusing,7,Invalid sentences
19941,We do not think the 56th Legislature was laboring under such restriction.,4,Analysis
19948,"We feel that the instant case was correctly disposed of by the trial court, and the judgment is affirmed.",5,Conclusion
20159,We find no error in the action of the trial court in overruling the objection.,5,Conclusion
20363,We find the evidence sufficient to support the trial court’s verdict.,5,Conclusion
20253,We find the evidence sufficient to sustain the conviction.,5,Conclusion
20003,We have been furnished with a certificate from the Texas Prison System showing that relator has served both sentences unless the cumulation be held effective.,1,Facts
20367,"We have carefully examined the record, and find no merit in any of appellant’s contention.",1,Facts
20127,"We have concluded that, under the facts, the requested charge in the instant case was not required.",5,Conclusion
20229,We have consistently held that such conduct constitutes reversible error.,5,Conclusion
20174,We overrule appellant’s contention that “proper predicate has not been laid.”,5,Conclusion
20099,"We overrule appellant’s remaining contention, presented by Informal Bill of Exception No. VI, that the court erred in permitting the State to inquire of appellant’s character witnesses if they had heard of certain acts of misconduct on the part of appellant.",4,Analysis
20340,We remain of the opinion that the evidence is sufficient to sustain the conviction.,5,Conclusion
19914,We shall discuss the facts more fully in connection with the contentions advanced by counsel by brief and in argument.,1,Facts
20123,We shall discuss the matters presented by the bills of exception and which are urged in the brief:,1,Facts
20168,We shall not separately discuss the remaining bills of exception.,1,Facts
20172,We think the chain of custody of the wine in question was,7,Invalid sentences
19943,We think there is no semblance or analogy between the authorities cited by appellant and this case.,5,Conclusion
20268,When appellant's counsel made his request the lists were in the hands of the clerk but had not been brought into the courtroom or compared.,1,Facts
20295,"When asked if he was shooting at Jimmy Ann Davis, appellant replied, “Yes sir.",1,Facts
20361,"When asked: “What factors do you consider, how do you determine when a person is or is not drunk?,” appellant replied: “Well, I would consider it if he couldn’t walk, drive or anything like that, that he had had too much.”",1,Facts
19979,When I arrived I confessed to her what I had did.”,1,Facts
20156,"When request for the “poop sheet” in question was made by appellant’s counsel, the witness did not have such sheet in his possession, nor was he using any notes or memoranda therefrom, the witness’s only statement concerning this being that the sheet was seen by him after its completion and that it was “fixed up” by him and another person referred to as “Bill”.",1,Facts
20077,"When they arrived she was crying, could not talk coherently, and, after her husband had been called and came to the house, she related to him what had happened to her.",1,Facts
20372,"Where appellant fails to apply for subpoenas for witnesses, the overruling of the motion for continuance to secure attendance of witnesses is not error.",4,Analysis
19902,"Where there are two or more district courts having concurrent jurisdiction and statutory authority to transfer cases from one to the other, the omission of such order of transfer in the record cannot be complained of by the appellant in the absence of a timely plea to the jurisdiction on that ground.",3,Rule/Law/Holding
20200,"While in his amended answer appellant alleged that the bond was invalid for various reasons, he did not, as pointed out in our original opinion, in any manner, deny execution of the bond.",2,Issue
20327,With such contention we do not agree.,5,Conclusion
19920,"Within a matter of minutes, McDade confessed, but told the officers that they had left the body of the deceased",1,Facts
