id,text,label_id,label_text
20323,"Testifying as a witness in his own behalf, appellant stated that, on the night in question, he had gone to the place to collect a debt; that the boy asked for a beer and then gave him the quarter which he gave to the bartender, who delivered the bottle of beer to appellant and he then gave the beer to the boy.",1,Facts
20166,Testimony read into the record without objection is tantamount to the introduction of the documents from which the testimony was taken.,4,Analysis
20031,"The above contention is not presented by a formal bill of exception or by a separate statement of facts as required by Art. 760e and 759a (6), V.A.C.C.P.",3,Rule/Law/Holding
20355,"The accident occurred in the 1400 block of the Harry Wurzbach Road in San Antonio, Bexar County, at about one o’clock, p.m.",1,Facts
19984,The act of the appellant in having the boys disrobe and taking pictures of them in a sexually excited physical condition as shown by the pictures was relevant as bearing on the lascivious intent of the appellant.,4,Analysis
19933,"The act, as amended, raised the age of children from “under sixteen years of age” to “under eighteen years of age.”",1,Facts
20201,The answer urging invalidity of the bond for the various reasons assigned did not constitute a plea of non est factum.,4,Analysis
20027,The appellant did not testify or offer any evidence in his behalf.,1,Facts
20273,The appellant’s motion for rehearing is granted; the opinion and order affirming the conviction is withdrawn and the judgment is now reversed and the cause remanded.,5,Conclusion
19900,"The appellants contend that a bail bond conditioned for the appearance of the accused before a designated court only, must be forfeited in that court.",2,Issue
20312,The arrest sheet appears in the record as a part of appellant’s bill of exception and we observe nothing therein which would impeach the testimony of the witness for the state.,4,Analysis
20002,The attempted cumulation is ineffective in that the designation of the Harris County court is absent.,1,Facts
19938,The caption made no mention whatsoever of any penalty to be included in the amending article.,1,Facts
19930,The caption of the act that appellant complains of reads as follows:,6,Others
19950,The caption of the amendatory act restricted the purpose of the bill to a change in the definition of the offense.,1,Facts
20016,The car was of the value of more than $50 and was taken without the owner’s consent.,1,Facts
20044,The case contained twelve quart bottles of Falstaff beer.,1,Facts
20141,The case was tried before a jury and a verdict,7,Invalid sentences
20163,The clerk testified that since the date of that election there had been no election declaring Smith County a wet area.,1,Facts
20256,The contention that such search was unlawful is overruled.,5,Conclusion
20008,"The conviction is for felony theft of an automobile; the punishment, 2 years.",3,Rule/Law/Holding
20091,The court also submitted to the jury the appellant’s defense of alibi and submitted to the jury the issue as to the voluntary nature of appellant’s written confession.,1,Facts
20030,"The court excused said juror and gave the appellant further opportunity to exercise his challenges on the jury list, which he refused to do, after which the next juror on the list was taken.",5,Conclusion
19926,The court found appellant guilty and punishment was assessed at confinement in the county jail for a period of six months.,1,Facts
20270,The court granted the request of counsel for the state and permitted the name of the Juror Olivares to be stricken and he was replaced.,1,Facts
20058,"The court instructed the jury that a public highway, as used in the court’s charge, “means a highway that was open on the date in question for use and traveled by the public.”",1,Facts
19889,The court stated in that case:,6,Others
20090,The court submitted the issue of appellant’s guilt to the jury upon a charge on circumstantial evidence and upon a charge on the law of rape by both force and threats.,2,Issue
19879,"The deceased was in the front seat of the latter car, opposite the driver, and was killed as a result of the collision between the two cars.",1,Facts
20214,"The deceased was murdered during the existence of and in the furtherance of the common design of appellant and his companions to commit robbery by using a loaded rifle, and the killing was a natural and probable consequence of such common plan and design.",4,Analysis
20332,The evidence clearly shows that appellant bought a bottle of beer for the minor and caused him to partake thereof.,4,Analysis
20154,"The evidence does not reflect the wet or dry status of Kilgore, and, at best, is conflicting as to appellant’s own testimony as to whether the consumption was to be by him or by his employees.",5,Conclusion
19890,"The evidence in the instant case being insufficient to sustain the conviction, the judgment is reversed and the cause is remanded.",5,Conclusion
20306,The evidence introduced by the state consisted of the testimony of two police officers who testified that they stopped appellant on Stemmons Freeway after observing him drive at a speed,1,Facts
19991,"The evidence is sufficient to support the conviction and no reversible error appearing, the judgment is affirmed .",5,Conclusion
20213,"The evidence shows that appellant knew that his companions were going to rob the service station operator when they got out of his car, that he waited nearby to carry them to safety, and that he expected to share in the fruits of the robbery.",1,Facts
20059,"The evidence shows that Arnold Boulevard was open and was traveled by the public on the date appellant drove thereon while intoxicated, though the evidence further shows that Dyess Air Force Base was fenced; the Boulevard was built by the government; there were gates which at times were closed and the Base Commander and those under his command were responsible for the controlling of vehicular traffic on its roads and could and would, at times in their discretion, obstruct ail entrances and bar admittance to anyone that wanted to enter.",4,Analysis
20028,The facts and circumstances in evidence warrant the conclusion by the jury that the appellant unlawfully took the Hatcher automobile as alleged in the indictment.,5,Conclusion
20257,The facts stated are sufficient to show probable cause for the search of the automobile.,5,Conclusion
19904,The failure of a bail bond to recite that the principal appear “for any and all.,7,Invalid sentences
19873,The following facts are undisputed:,6,Others
19951,The framers of the bill thus informed the public and their fellow legislators that the purpose of the bill was to change the definition.,1,Facts
20062,The gates had been opened by the construction company and the highway was being used by the public.,1,Facts
20014,The Hatcher boy shot at their car with a .22 rifle as it was being driven away.,1,Facts
20011,The Hatcher family resided near a curve on the highway three and one-half miles from Morton and about thirty-five miles from Littlefield and were awakened by a loud noise about 4 A.M. on January 4.,1,Facts
20071,The husband worked at night at a local service station.,4,Analysis
20345,"The indictment alleged the fraudulent taking of an automobile of a value in excess of $50, from the possession of the owner, without his consent, with the intent to deprive the owner of its value and to appropriate it to his own use and benefit.",1,Facts
20348,"The indictment is in the ordinary form for charging felony theft, and alleged that the automobile was taken without the owner’s consent.",1,Facts
20317,"The information alleged that the appellant did contribute to the delinquency of the minor, a male- child under the age of seventeen years:",1,Facts
20330,"The information in the instant case charged two different ways under the statute that appellant committed the offense, namely by inviting the minor to go to the place where intoxicating liquors were sold and by causing him to drink intoxicating liquor.",4,Analysis
20015,The inside of the Hatcher car was clean and in good condition.,1,Facts
19987,The judgment affirmatively recites that when the appellant entered his plea of guilty he was admonished by the court of the consequences of said plea.,4,Analysis
19899,The judgment final recites that the appellants appeared in person and each announced ready for trial.,1,Facts
20350,The judgment is affirmed.,5,Conclusion
20282,The jury resolved the issue against appellant and the evidence is sufficient to sustain their findings.,5,Conclusion
20309,"The jury resolved the issue against appellant, and the evidence is sufficient to sustain the verdict.",1,Facts
19877,"The markings and tracks on the road showed that appellant’s car had left the hard-surface portion of the road at about the crest of the hill and off to the east shoulder of the road, before the contact, and there were tracks leading back toward the highway from appellant’s car.",1,Facts
20321,"The minor stated that, on such occasion, appellant did not ask him his age and that he had taken one drink from the bottle before the officers arrived.",1,Facts
20242,The motion and amended motion for new trial are silent as to any error in the argument or in the overruling of the motion for mistrial.,1,Facts
20000,The motion for rehearing is denied.,5,Conclusion
20341,The motion for rehearing is overruled.,5,Conclusion
20206,The motion is overruled.,5,Conclusion
20171,The objection was that proper predicate had not been laid to the introduction into the record “as it stands at this moment.”,2,Issue
20036,The objections to the charge are that it shifts the burden of proof to the appellant; that it fails to charge the law of reason,4,Analysis
20286,"The offense is assault with intent to murder; the punishment, 2 years.",2,Issue
20274,"The offense is driving a motor vehicle upon a public highway while intoxicated; the punishment, 30 days in jail and a fine of $150.",2,Issue
20263,"The offense is driving while intoxicated, as a second offender; the punishment, one year in jail.",2,Issue
20219,"The offense is driving while intoxicated: the punishment, 3 days in jail and a fine of $50.00.",2,Issue
20305,"The offense is driving while intoxicated; the punishment, 3 days in jail and a fine of $50.",2,Issue
20300,"The offense is driving while intoxicated; the punishment, three days in jail and a fine of $150.00.",2,Issue
20344,"The offense is felony theft by false pretext; the punishment, two years.",2,Issue
19932,The offense is made a misdemeanor punishable by confinement not to exceed two years in jail.,3,Rule/Law/Holding
20247,"The offense is unlawfully carrying a pistol; the punishment, a fine of $100.",2,Issue
20250,The officer asked him if he was having trouble and he said his car would not start.,1,Facts
20307,The officers described appellant’s appearance and conduct and expressed the opinion that he was definitely intoxicated.,1,Facts
20276,The officers expressed the opinion that appellant was “very intoxicated.”,1,Facts
20144,"The officers stopped appellant, who, with Lacy, got out of the truck and met the officers about half-way between the truck and the officers’ car.",1,Facts
20126,"The officers testified that this man lying on the ground was the accused, and this court held that the charge on circumstantial evidence was not required.",1,Facts
20147,The officers unloaded “all that stuff” and filed on appellant for transporting wine.,1,Facts
20145,"The officers walked up to the truck, looked in, and found “a load of cased wine and stuff,” being “fifteen cases of wine, ten cases of quart beer, and about ten half-pints of whisky in a paper sack.”",1,Facts
20311,The only bill of exception which merits discussion relates to the refusal of the court to require counsel for the state to allow appellant’s counsel to examine an arrest sheet or statement of a state witness for cross-examination purposes.,2,Issue
19875,The point of contact between the two cars occurred below the crest of a hill on the highway.,1,Facts
20244,The presumption is that the trial judge ruled correctly when he declined to order a mistrial during the closing argument.,4,Analysis
19895,The principal was charged by complaint in the justice court with robbery and required to give bond in the sum of $2500 for his appearance in the Criminal District Court of Tarrant County.,2,Issue
19934,"The prior act provided for confinement in the penitentiary for not more than two years and also contained a provision for confinement in jail and a provision for a fine of not less than $25 nor more than $500, or by such fine and imprisonment in jail.",3,Rule/Law/Holding
20304,"The proceedings appear to be regular, and the judgment is affirmed.",5,Conclusion
19983,"The prosecuting witness testified and the appellant, while testifying, admitted that he personally took the pictures of the boys in the nude in his apartment.",1,Facts
19966,"The prosecuting witness, an eleven year old boy, testified that on April 20,1959, he along with his younger brother and another boy, at appellant’s request went to appellant’s apartment and that while there, appellant fondled his sexual parts, committed an act of oral sodomy upon him, and had him commit such act upon him (appellant); that the appellant had him and his brother commit acts of rectal sodomy on each other; and that the appellant inserted a plastic tube in his (witness’) rectum.",1,Facts
20072,"The prosecutrix testified that, on the night in question after she had retired around 11:30 p.m., she was awakened by a man who was lying on top of her; that when he attempted to have intercourse with her she screamed, got out of bed, and the man then dragged her into an adjoining room where her baby was sleeping; that the man threatened to cut both her and the baby and threatened their lives; that, after she quieted the baby, they then returned to her room where the man tore her gown off and had carnal knowledge of her against her will and without her consent.",1,Facts
19960,"The purported formal bill of exception, although not filed within the time required by statute, was refused by the trial judge for the reason thereon stated when presented to him for approval.",1,Facts
20227,The purpose of argument is to assist the jury in properly analyzing the evidence and arriving at a verdict based on the evidence alone.,1,Facts
20056,"The question for our decision is whether said Boulevard was a public road, street or highway.",2,Issue
20100,The questions were not so framed as to infer as a fact,1,Facts
20346,The record contains no statement of facts.,1,Facts
20150,The record contains twenty-one formal bills of exception and numerous intormai bills.,1,Facts
20353,"The record reflects that on March 11, 1960, appellant, while driving his automobile, was involved in an accident with another .vehicle driven by G.",7,Invalid sentences
20162,"The record reflects that the county clerk of Smith County testified directly from the commissioners court records and read, completely, the order requiring the election prohibiting the sale of wine, the order declaring the results of said election, and the publication of the resuts of the election, giving the volume and page number of the minutes of the commissioners court wherein each of the orders appeared.",4,Analysis
19988,The record shows that appellant filed a written motion before the indictment was read and before he was asked for his plea which was presented to and overruled by the trial judge.,1,Facts
20266,"The record shows that counsel for the defendant made his request before the list of jurors chosen had been prepared by the clerk and, according to said counsel’s affidavit, “before either defendant or affiant had seen the list furnished said clerk by counsel for the State, and not knowing what if any strikes the State had made thereon.”",1,Facts
20096,"The record shows that such outcry was made by the prosecutrix to her husband shortly after she was raped and, at the time, she was crying, nervous, and in shock.",1,Facts
20157,The right to see a document or writing does not obtain when such writing is not used by the state before the jury in some way so as to make the contents thereof an issue.,3,Rule/Law/Holding
20255,"The search was not made as an incident to the arrest of appellant for the offense of unlawfully carrying on or about her person a pistol, but as an incident to the search of the driver of the automobile in the investigation of the burglary or attempted burglary of the drug store.",4,Analysis
19876,The Smith car had crossed over the yellow stripe in Smith’s lane and on over to his left-hand shoulder of the road.,1,Facts
20347,The sole contention on appeal is that the indictment is fatally defective in that it attempts to allege theft by false pretext and fails to allege that the defendant did appropriate the automobile.,2,Issue
20298,"The sole defense raised by appellant’s testimony was that he shot the injured person in the protection of his property, which was adequately and correctly submitted in the court’s charge.",1,Facts
19884,The sole point of contention raised by appellant is the sufficiency of the evidence to sustain the conviction.,2,Issue
19886,The state does not here seek an affirmance.,1,Facts
20167,The state here discharged its duty in showing the dry status of Smith County.,1,Facts
19885,"The state’s attorney before this court points out in his brief that this case is controlled, as contended by appellant, by the case of Hubbard v.",7,Invalid sentences
19883,"The state’s other witness, Patrolman Clark, testified to substantially the same facts and expressed the same opinion as the first witness, Vinyard.",1,Facts
20070,The state’s proof shows that the prosecutrix lived at a certain address in the city of Abilene with her husband and nine 'months old son.,4,Analysis
20358,The state’s witnesses G.,7,Invalid sentences
19969,The statement in part reads:,1,Facts
19955,"The statement of facts accompanying this record has not been approved by the trial judge nor agreed to by counsel, as required by Article 759a, V.A.C.C.P.",1,Facts
20301,The statement of facts appearing in the record has been approved by counsel for appellant only.,1,Facts
20208,The statement of facts reflects that Herman L. Curtis was killed when two .22 caliber rifle bullets were fired into his chest while he was operating a service station.,1,Facts
19995,The statement of facts reveals that the careful trial judge twice rejected the state’s tender of the two photographs into the evidence and that he did not admit them until the appellant took the stand in his own behalf and properly identified them.,4,Analysis
20356,"The sun was shining at the time, and the weather was fairly warm.",1,Facts
20329,"The term “delinquency” is defined as meaning any act which tends to debase the morals, health, or welfare of such child and includes, among other acts, “drinking intoxicating liquor” or “going into a place where intoxicating liquors * * * are kept, drunk, used or sold.”",3,Rule/Law/Holding
20142,"The testimony of witnesses for the state and for appellant reflects that Deputy Sheriff Williams and Everett were patrolling the Van highway beyond the “Loop” from the city of Tyler when they observed appellant, accompanied by a man by the name of J. W. Lacy, driving a pickup truck and entering the highway from a farm-to-market road “that comes off the Mineola and Van highway.”",1,Facts
20226,The testimony reflected no prior confinement in jail.,1,Facts
20175,"The testimony shows that the wine was placed in the custody of the district attorney at the courthouse and properly labeled at the time, by written identification on the cases, and that the bottles were those found at the scene.",4,Analysis
20019,"The tracks of a man in front of the Oldsmobile leading toward the Hatcher residence were seen, but they disappeared at the driveway.",1,Facts
20241,The trial judge does not appear to have been given the opportunity to require the record presentd as an informal bill to,7,Invalid sentences
20231,"The trial judge sustained appellant’s objection and instructed the jury to disregard such remarks, but overruled appellant’s motion for mistrial.",5,Conclusion
19872,The trial was to the court without a jury.,1,Facts
20042,The undisputed testimony reflects that appellant was driving a pickup truck in the city of Abilene and hit a center island in the street.,1,Facts
20117,The witness expressed the opinion that from the way appellant “smelled” and from the way he acted appellant was “drunk.”,1,Facts
20114,"The witness expressed the opinion that from what appellant said, his conduct, and the “way he smelled” appellant was “drunk.”",1,Facts
20115,The witness further testified that “a piece of a bottle” of what he believed was gin was taken out of the automobile.,1,Facts
20110,"The witness Saxton testified that on the night of July 4, while at home, he heard a noise which sounded like a “car collision” and went to investigate, and that he observed an automobile sitting “crossways” about four or five feet from the pavement on the road running from Grand Saline to Alba, and the appellant lying on the ground on the driver’s side about eight feet from the automobile.",1,Facts
20118,The witness then testified that he assisted in taking appellant to jail.,1,Facts
19990,"There appears no error in the action of the court in declining in the absence of the appellant, to hear an amended motion for new trial which had been overruled by operation of law.",5,Conclusion
20364,"There are no formal bills of exception, nor are there any informal bills.",1,Facts
20303,There are no formal bills of exception.,1,Facts
20331,"There being no repugnancy between the ways charged, such was permissible.",4,Analysis
20184,There is no showing in this record as to what information was contained in the memorandum or that it in any way conflicted with the testimony the witness had given.,4,Analysis
20176,There is no showing that anyone other than the officers ever had the wine in custody.,4,Analysis
20023,"There was a bullet hole in the right front fender, blood on the left door, and a man’s tracks leading from the left side away from the car.",1,Facts
19985,"Therefore, the admission of the pictures in evidence was not error.",5,Conclusion
20134,"These facts, we have concluded, justified the complained-of argument.",5,Conclusion
19909,"They immediately purchased two new suits of clothes with bills of large denomination, and some jewelry; took a bath, changed clothes, and stated that they were on their way to Houston.",1,Facts
19910,They were arrested before leaving Big Spring.,1,Facts
19997,"They were taken by the appellant, himself, at the time of the transaction.",1,Facts
20046,"Thirty-five bottles of Falstaff beer, containing thirty-two ounces each, were introduced by the state.",1,Facts
20051,"This apparently contains objections made during the trial, which are here considered as informal bills of exception where they appear in the statement of facts.",1,Facts
20243,"This case, I think, demonstrates the correctness of the views I expressed in Kinnebrew v.",7,Invalid sentences
20035,This complaint presents no reversible error.,5,Conclusion
20187,"This is an appeal by Jimmy Martin, surety on the habeas corpus bond of Charles Henry Glover, from the final judgment of the County Criminal Court No. 3 of Dallas County.",2,Issue
19894,"This is an appeal by Toby Goldsmith and Phil Becker, sureties on the bail bond of Willie Mack Daniels, from the judgment final of Criminal District Court No. 2 of Tarrant County upon a forfeiture of said bail bond.",1,Facts
20001,"This is an original application for a writ of habeas corpus brought by the relator John Leonard Lee, seeking his release from the Texas Prison System.",2,Issue
19989,"This motion shows that he did have knowledge of the nature and consequences of his plea, therefore no reversible error is shown.",5,Conclusion
19971,This they all three did except David he did drop his pants and shorts.,1,Facts
20045,Three additional cases of beer were found stacked behind the back part of the seat and a bottle of beer was found in the glove compartment.,1,Facts
20106,Time is not the sole test for either the admission or rejection of such proof; instinctiveness is the requisite.”,1,Facts
20191,"To raise the issue that the appellant as surety did not sign the bond, the answer must contain an affirmative verified plea of non est factum.",2,Issue
19942,"To the contrary, the caption of the enactment under review in clear and unambiguous language placed the public and the legislature on notice that the purpose of the act was, among other things, to add “a new article,” fix “a penalty,” and to provide for a second conviction and conviction for deserting and leaving the state.",4,Analysis
19925,"Trial was had before the court without the aid of a jury, upon a plea of not guilty.",1,Facts
20352,Trial was to the court without the aid of a jury.,1,Facts
20211,Two questions are presented for review.,1,Facts
20097,"Under the record, the testimony was admissible under the rule stated in 4 Branch’s Ann.",5,Conclusion
20095,"Under the record, we find no error in admitting such testimony.",5,Conclusion
20203,"Under the record, we remain convinced that the issue of appellant’s execution of the bond was not raised by a proper plea of non est factum and that the court did not err in overruling the motion for new trial on such ground.",4,Analysis
20041,"Unlawful possession of beer for the purpose of sale in a dry area is the offense; the punishment, a $500 fine and six months in jail.",2,Issue
